{
  "name": "transactions",
  "description": "Transactions log",
  "template": [
    "### Transaction {id} started at: {started_at}",
    "Status: {status}",
    "User: {user}",
    { "vec": "operations", "template": "operation_type: {operation_type}" },
    {
      "vec": "votes",
      "template": "ReqId: {req_id}, Actor: {actor}, VotingStatus: {voting_status}",
      "auto_fields": false
    },
    {
      "vec": "abort_stage",
      "template": "ReqId: {req_id}, Actor: {actor}, AbortStatus: {abort_status}",
      "auto_fields": false
    },
    "### Transaction ended at: {ended_at}"
  ],
  "fields": {
    "id": "extra",
    "started_at": "extra"
  }
}
